{
  "namespace": "ssvc",
  "version": "1.0.0",
  "key": "U",
  "name": "Utility",
  "description": "The Usefulness of the Exploit to the Adversary",
  "values": [
    {
      "key": "L",
      "name": "Laborious",
      "description": "Virulence:Slow and Value Density:Diffuse"
    },
    {
      "key": "E",
      "name": "Efficient",
      "description": "Virulence:Rapid and Value Density:Diffuse OR Virulence:Slow and Value Density:Concentrated"
    },
    {
      "key": "S",
      "name": "Super Effective",
      "description": "Virulence:Rapid and Value Density:Concentrated"
    }
  ]
}