{
  "namespace": "ssvc",
  "version": "1.0.0",
  "name": "Technical Impact",
  "description": "The technical impact of the vulnerability.",
  "key": "TI",
  "values": [
    {
      "name": "Partial",
      "description": "The exploit gives the adversary limited control over, or information exposure about, the behavior of the software that contains the vulnerability. Or the exploit gives the adversary an importantly low stochastic opportunity for total control.",
      "key": "P"
    },
    {
      "name": "Total",
      "description": "The exploit gives the adversary total control over the behavior of the software, or it gives total disclosure of all information on the system that contains the vulnerability.",
      "key": "T"
    }
  ]
}