{
  "namespace": "ssvc",
  "version": "2.0.0",
  "key": "PSI",
  "name": "Public Safety Impact",
  "description": "A coarse-grained representation of impact to public safety.",
  "values": [
    {
      "key": "M",
      "name": "Minimal",
      "description": "Safety Impact:(None OR Minor)"
    },
    {
      "key": "S",
      "name": "Significant",
      "description": "Safety Impact:(Major OR Hazardous OR Catastrophic)"
    }
  ]
}