{
  "namespace": "ssvc",
  "version": "1.0.0",
  "name": "Supplier Contacted",
  "description": "Has the reporter made a good-faith effort to contact the supplier of the vulnerable component using a quality contact method?",
  "key": "SC",
  "values": [
    {
      "name": "No",
      "description": "The supplier has not been contacted.",
      "key": "N"
    },
    {
      "name": "Yes",
      "description": "The supplier has been contacted.",
      "key": "Y"
    }
  ]
}