{
  "namespace": "ssvc",
  "version": "1.0.0",
  "name": "Automatable",
  "description": "Can an attacker reliably automate creating exploitation events for this vulnerability?",
  "key": "A",
  "values": [
    {
      "name": "No",
      "description": "Attackers cannot reliably automate steps 1-4 of the kill chain for this vulnerability. These steps are (1) reconnaissance, (2) weaponization, (3) delivery, and (4) exploitation.",
      "key": "N"
    },
    {
      "name": "Yes",
      "description": "Attackers can reliably automate steps 1-4 of the kill chain.",
      "key": "Y"
    }
  ]
}