{
  "namespace": "ssvc",
  "version": "1.0.1",
  "key": "U",
  "name": "Utility",
  "description": "The Usefulness of the Exploit to the Adversary",
  "values": [
    {
      "key": "L",
      "name": "Laborious",
      "description": "Automatable:No and Value Density:Diffuse"
    },
    {
      "key": "E",
      "name": "Efficient",
      "description": "Automatable:Yes and Value Density:Diffuse OR Automatable:No  and Value Density:Concentrated"
    },
    {
      "key": "S",
      "name": "Super Effective",
      "description": "Automatable:Yes and Value Density:Concentrated"
    }
  ]
}