{
  "namespace": "ssvc",
  "version": "1.0.0",
  "name": "Report Public",
  "description": "Is a viable report of the details of the vulnerability already publicly available?",
  "key": "RP",
  "values": [
    {
      "name": "No",
      "description": "No public report of the vulnerability exists.",
      "key": "N"
    },
    {
      "name": "Yes",
      "description": "A public report of the vulnerability exists.",
      "key": "Y"
    }
  ]
}