{
  "namespace": "ssvc",
  "version": "1.0.0",
  "key": "HI",
  "name": "Human Impact",
  "description": "Human Impact is a combination of Safety and Mission impacts.",
  "values": [
    {
      "key": "L",
      "name": "Low",
      "description": "Safety=None/Minor, Mission=None/Degraded/Crippled"
    },
    {
      "key": "M",
      "name": "Medium",
      "description": "Safety=None/Minor, Mission=MEF Failure OR Safety=Major, Mission=None/Degraded/Crippled"
    },
    {
      "key": "H",
      "name": "High",
      "description": "Safety=Hazardous, Mission=None/Degraded/Crippled/MEF Failure OR Safety=Major, Mission=MEF Failure"
    },
    {
      "key": "VH",
      "name": "Very High",
      "description": "Safety=Catastrophic OR Mission=Mission Failure"
    }
  ]
}