{
  "namespace": "ssvc",
  "version": "1.0.0",
  "name": "Public Safety Impact",
  "description": "A coarse-grained representation of impact to public safety.",
  "key": "PSI",
  "values": [
    {
      "name": "Minimal",
      "description": "Safety impact of None or Minor.",
      "key": "M"
    },
    {
      "name": "Significant",
      "description": "Safety impact of Major, Hazardous, or Catastrophic.",
      "key": "S"
    }
  ]
}