{
  "namespace": "ssvc",
  "version": "1.0.0",
  "name": "Value Density",
  "description": "The concentration of value in the target",
  "key": "VD",
  "values": [
    {
      "name": "Diffuse",
      "description": "The system that contains the vulnerable component has limited resources. That is, the resources that the adversary will gain control over with a single exploitation event are relatively small.",
      "key": "D"
    },
    {
      "name": "Concentrated",
      "description": "The system that contains the vulnerable component is rich in resources. Heuristically, such systems are often the direct responsibility of \u201csystem operators\u201d rather than users.",
      "key": "C"
    }
  ]
}